{
  "manifest_version": "0.2.0",
  "compiler_version": "0.1.0",
  "schema_version": "0.2.0",
  "template_version": "0.1.0",
  "source_id": "0a1b2c3d4e5f",
  "bundle_id": "bundle-0a1b2c3d4e5f-v0_1_0",
  "skill_hashes": {
    "write_entry": "aaaaaaaaaaaaaaaaaaaaaaaaaaaaaaaaaaaaaaaaaaaaaaaaaaaaaaaaaaaaaaaa",
    "scene_design": "aaaaaaaaaaaaaaaaaaaaaaaaaaaaaaaaaaaaaaaaaaaaaaaaaaaaaaaaaaaaaaaa",
    "character_beats": "aaaaaaaaaaaaaaaaaaaaaaaaaaaaaaaaaaaaaaaaaaaaaaaaaaaaaaaaaaaaaaaa",
    "prose_draft": "aaaaaaaaaaaaaaaaaaaaaaaaaaaaaaaaaaaaaaaaaaaaaaaaaaaaaaaaaaaaaaaa",
    "style_check": "aaaaaaaaaaaaaaaaaaaaaaaaaaaaaaaaaaaaaaaaaaaaaaaaaaaaaaaaaaaaaaaa",
    "revision": "aaaaaaaaaaaaaaaaaaaaaaaaaaaaaaaaaaaaaaaaaaaaaaaaaaaaaaaaaaaaaaaa"
  },
  "staging_path": "private-ledger://synthetic-run/staging",
  "ordering": "path_sorted"
}
